{
  "$schema": "https://json-schema.org/draft/2020-12/schema",
  "$id": "tenra-align.review-reply-route.v1",
  "title": "Align review reply route",
  "type": "object",
  "additionalProperties": true,
  "required": [
    "schema",
    "exportedAt",
    "sourceApp",
    "locationId",
    "reviewId",
    "publishEnabled",
    "proxyShapeRequest",
    "guardrailReviewRequest"
  ],
  "properties": {
    "schema": {
      "const": "tenra-align.review-reply-route.v1",
      "type": "string"
    },
    "exportedAt": {
      "type": "string"
    },
    "sourceApp": {
      "type": "string"
    },
    "locationId": {
      "type": "string"
    },
    "reviewId": {
      "type": "string"
    },
    "publishEnabled": {
      "type": "boolean"
    },
    "proxyShapeRequest": {
      "type": "object"
    },
    "guardrailReviewRequest": {
      "type": "object"
    }
  },
  "x-tenra": {
    "ownerApp": "align",
    "producerApp": "align",
    "consumerApps": [
      "guardrail",
      "proxy"
    ],
    "fixture": "tenra Align/fixtures/handoffs/review-reply-route.json",
    "correlationFields": [
      "reviewId",
      "guardrailReviewRequest.traceId",
      "proxyShapeRequest.traceId"
    ],
    "standardControls": [
      "schema badge",
      "correlation id",
      "route timeline",
      "conflict history",
      "history"
    ]
  }
}
