{
  "schema": "tenra-align.review-reply-route.v1",
  "exportedAt": "2026-05-06T17:35:00.000Z",
  "sourceApp": "align",
  "locationId": "loc-northstar-midtown",
  "reviewId": "review-demo",
  "publishEnabled": false,
  "proxyShapeRequest": {
    "clientApp": "align",
    "surface": "support-note",
    "profileId": "profile:default",
    "purpose": "Shape a Google Business Profile review reply draft before operator review.",
    "draftText": "Draft a location-specific reply for Jamie Lee's 4-star review at Northstar Dental - Midtown.",
    "audience": "public reviewer",
    "sourceArtifact": {
      "schema": "tenra-align.review-reply-route.v1",
      "artifactId": "review-demo",
      "exportedAt": "2026-05-06T17:35:00.000Z"
    },
    "hardConstraints": [
      "Do not publish directly",
      "Do not invent service recovery details",
      "Keep the reply location-specific"
    ],
    "traceId": "align-review-review-demo-proxy"
  },
  "guardrailReviewRequest": {
    "schema": "tenra-guardrail.external-action-review.v1",
    "exportedAt": "2026-05-06T17:35:00.000Z",
    "sourceApp": "align",
    "actionKind": "send-message",
    "actorLabel": "Align review inbox",
    "targetLabel": "GBP review reply for Northstar Dental - Midtown",
    "summary": "Align prepared a review-reply draft. Publishing remains disabled until Guardrail approves the external action.",
    "evidence": [
      {
        "label": "Location",
        "value": "Northstar Dental - Midtown"
      },
      {
        "label": "Review author",
        "value": "Jamie Lee"
      },
      {
        "label": "Review rating",
        "value": "4"
      },
      {
        "label": "Review status",
        "value": "needs_reply"
      }
    ],
    "recommendedDecision": "review",
    "traceId": "align-review-review-demo-guardrail"
  }
}
